No.     Time           Source                Destination           Protocol Length Info
    327 6.135158       10.112.218.104        62.234.120.220        HTTP     464    GET /lab_upload/test/test4.php HTTP/1.1 

Frame 327: 464 bytes on wire (3712 bits), 464 bytes captured (3712 bits) on interface 0
Ethernet II, Src: IntelCor_c4:cc:a5 (68:07:15:c4:cc:a5), Dst: Hangzhou_53:00:02 (74:1f:4a:53:00:02)
Internet Protocol Version 4, Src: 10.112.218.104, Dst: 62.234.120.220
Transmission Control Protocol, Src Port: 60549, Dst Port: 80, Seq: 1, Ack: 1, Len: 410
Hypertext Transfer Protocol

No.     Time           Source                Destination           Protocol Length Info
    338 6.212911       62.234.120.220        10.112.218.104        HTTP     460    HTTP/1.1 200 OK  (text/html)

Frame 338: 460 bytes on wire (3680 bits), 460 bytes captured (3680 bits) on interface 0
Ethernet II, Src: Hangzhou_53:00:02 (74:1f:4a:53:00:02), Dst: IntelCor_c4:cc:a5 (68:07:15:c4:cc:a5)
Internet Protocol Version 4, Src: 62.234.120.220, Dst: 10.112.218.104
Transmission Control Protocol, Src Port: 80, Dst Port: 60549, Seq: 4273, Ack: 411, Len: 406
[4 Reassembled TCP Segments (4678 bytes): #330(1424), #331(1424), #337(1424), #338(406)]
Hypertext Transfer Protocol
Line-based text data: text/html (57 lines)

No.     Time           Source                Destination           Protocol Length Info
    345 6.286625       2001:da8:7013:9006:2545:2efb:a26c:bb9b 2001:da8:7013:8104::a044 HTTP     479    GET /_upload/tpl/template65/images/head.jpg HTTP/1.1 

Frame 345: 479 bytes on wire (3832 bits), 479 bytes captured (3832 bits) on interface 0
Ethernet II, Src: IntelCor_c4:cc:a5 (68:07:15:c4:cc:a5), Dst: Hangzhou_53:00:02 (74:1f:4a:53:00:02)
Internet Protocol Version 6, Src: 2001:da8:7013:9006:2545:2efb:a26c:bb9b, Dst: 2001:da8:7013:8104::a044
Transmission Control Protocol, Src Port: 60551, Dst Port: 80, Seq: 1, Ack: 1, Len: 405
Hypertext Transfer Protocol

No.     Time           Source                Destination           Protocol Length Info
    453 6.371220       2001:da8:7013:8104::a044 2001:da8:7013:9006:2545:2efb:a26c:bb9b HTTP     1058   HTTP/1.1 200 OK  (JPEG JFIF image)

Frame 453: 1058 bytes on wire (8464 bits), 1058 bytes captured (8464 bits) on interface 0
Ethernet II, Src: Hangzhou_53:00:02 (74:1f:4a:53:00:02), Dst: IntelCor_c4:cc:a5 (68:07:15:c4:cc:a5)
Internet Protocol Version 6, Src: 2001:da8:7013:8104::a044, Dst: 2001:da8:7013:9006:2545:2efb:a26c:bb9b
Transmission Control Protocol, Src Port: 80, Dst Port: 60551, Seq: 68983, Ack: 406, Len: 984
[96 Reassembled TCP Segments (69966 bytes): #348(1436), #349(4), #350(1436), #351(4), #352(1436), #354(4), #355(1436), #356(4), #357(1436), #358(4), #359(1302), #360(1436), #361(4), #362(1436), #363(4), #364(1436), #365(4), #366(1436), #367]
Hypertext Transfer Protocol
JPEG File Interchange Format

No.     Time           Source                Destination           Protocol Length Info
    463 6.453721       10.112.218.104        101.226.197.79        HTTP     457    GET /pic/0/98/9849/984926preview4.jpg HTTP/1.1 

Frame 463: 457 bytes on wire (3656 bits), 457 bytes captured (3656 bits) on interface 0
Ethernet II, Src: IntelCor_c4:cc:a5 (68:07:15:c4:cc:a5), Dst: Hangzhou_53:00:02 (74:1f:4a:53:00:02)
Internet Protocol Version 4, Src: 10.112.218.104, Dst: 101.226.197.79
Transmission Control Protocol, Src Port: 60552, Dst Port: 80, Seq: 1, Ack: 1, Len: 403
Hypertext Transfer Protocol

No.     Time           Source                Destination           Protocol Length Info
    496 6.543102       101.226.197.79        10.112.218.104        HTTP     1511   HTTP/1.1 200 OK  (JPEG JFIF image)

Frame 496: 1511 bytes on wire (12088 bits), 1511 bytes captured (12088 bits) on interface 0
Ethernet II, Src: Hangzhou_53:00:02 (74:1f:4a:53:00:02), Dst: IntelCor_c4:cc:a5 (68:07:15:c4:cc:a5)
Internet Protocol Version 4, Src: 101.226.197.79, Dst: 10.112.218.104
Transmission Control Protocol, Src Port: 80, Dst Port: 60552, Seq: 30661, Ack: 404, Len: 1457
[22 Reassembled TCP Segments (32117 bytes): #468(1460), #469(1460), #470(1460), #471(1460), #472(1460), #474(1460), #475(1460), #476(1460), #477(1460), #479(1460), #483(1460), #484(1460), #486(1460), #487(1460), #488(1460), #489(1460), #490]
Hypertext Transfer Protocol
JPEG File Interchange Format

No.     Time           Source                Destination           Protocol Length Info
    499 6.556358       10.112.218.104        62.234.120.220        HTTP     432    GET /favicon.ico HTTP/1.1 

Frame 499: 432 bytes on wire (3456 bits), 432 bytes captured (3456 bits) on interface 0
Ethernet II, Src: IntelCor_c4:cc:a5 (68:07:15:c4:cc:a5), Dst: Hangzhou_53:00:02 (74:1f:4a:53:00:02)
Internet Protocol Version 4, Src: 10.112.218.104, Dst: 62.234.120.220
Transmission Control Protocol, Src Port: 60549, Dst Port: 80, Seq: 411, Ack: 4679, Len: 378
Hypertext Transfer Protocol

No.     Time           Source                Destination           Protocol Length Info
    716 6.895468       62.234.120.220        10.112.218.104        HTTP     722    HTTP/1.1 200 OK  (image/x-icon)

Frame 716: 722 bytes on wire (5776 bits), 722 bytes captured (5776 bits) on interface 0
Ethernet II, Src: Hangzhou_53:00:02 (74:1f:4a:53:00:02), Dst: IntelCor_c4:cc:a5 (68:07:15:c4:cc:a5)
Internet Protocol Version 4, Src: 62.234.120.220, Dst: 10.112.218.104
Transmission Control Protocol, Src Port: 80, Dst Port: 60549, Seq: 206887, Ack: 789, Len: 668
[146 Reassembled TCP Segments (202876 bytes): #509(1424), #510(1424), #511(1424), #512(1424), #513(1424), #516(1424), #517(1424), #518(1424), #519(1424), #520(1424), #522(1424), #523(1424), #524(1424), #526(1424), #530(1424), #531(1424), #5]
Hypertext Transfer Protocol
Media Type
