No.     Time           Source                Destination           Protocol Length Info
     23 9.721560000    192.168.43.208        62.234.120.220        TCP      66     52472 > http [SYN] Seq=0 Win=8192 Len=0 MSS=1460 WS=256 SACK_PERM=1

Frame 23: 66 bytes on wire (528 bits), 66 bytes captured (528 bits) on interface 0
Ethernet II, Src: 68:07:15:c4:cc:a5 (68:07:15:c4:cc:a5), Dst: 94:65:2d:4e:c2:06 (94:65:2d:4e:c2:06)
Internet Protocol Version 4, Src: 192.168.43.208 (192.168.43.208), Dst: 62.234.120.220 (62.234.120.220)
Transmission Control Protocol, Src Port: 52472 (52472), Dst Port: http (80), Seq: 0, Len: 0

No.     Time           Source                Destination           Protocol Length Info
     24 9.776351000    62.234.120.220        192.168.43.208        TCP      66     http > 52472 [SYN, ACK] Seq=0 Ack=1 Win=8192 Len=0 MSS=1400 WS=256 SACK_PERM=1

Frame 24: 66 bytes on wire (528 bits), 66 bytes captured (528 bits) on interface 0
Ethernet II, Src: 94:65:2d:4e:c2:06 (94:65:2d:4e:c2:06), Dst: 68:07:15:c4:cc:a5 (68:07:15:c4:cc:a5)
Internet Protocol Version 4, Src: 62.234.120.220 (62.234.120.220), Dst: 192.168.43.208 (192.168.43.208)
Transmission Control Protocol, Src Port: http (80), Dst Port: 52472 (52472), Seq: 0, Ack: 1, Len: 0

No.     Time           Source                Destination           Protocol Length Info
     25 9.776586000    192.168.43.208        62.234.120.220        TCP      54     52472 > http [ACK] Seq=1 Ack=1 Win=16384 Len=0

Frame 25: 54 bytes on wire (432 bits), 54 bytes captured (432 bits) on interface 0
Ethernet II, Src: 68:07:15:c4:cc:a5 (68:07:15:c4:cc:a5), Dst: 94:65:2d:4e:c2:06 (94:65:2d:4e:c2:06)
Internet Protocol Version 4, Src: 192.168.43.208 (192.168.43.208), Dst: 62.234.120.220 (62.234.120.220)
Transmission Control Protocol, Src Port: 52472 (52472), Dst Port: http (80), Seq: 1, Ack: 1, Len: 0

No.     Time           Source                Destination           Protocol Length Info
     26 9.777223000    192.168.43.208        62.234.120.220        TCP      925    [TCP segment of a reassembled PDU]

Frame 26: 925 bytes on wire (7400 bits), 925 bytes captured (7400 bits) on interface 0
Ethernet II, Src: 68:07:15:c4:cc:a5 (68:07:15:c4:cc:a5), Dst: 94:65:2d:4e:c2:06 (94:65:2d:4e:c2:06)
Internet Protocol Version 4, Src: 192.168.43.208 (192.168.43.208), Dst: 62.234.120.220 (62.234.120.220)
Transmission Control Protocol, Src Port: 52472 (52472), Dst Port: http (80), Seq: 1, Ack: 1, Len: 871

No.     Time           Source                Destination           Protocol Length Info
     27 9.777479000    192.168.43.208        62.234.120.220        TCP      1454   [TCP segment of a reassembled PDU]

Frame 27: 1454 bytes on wire (11632 bits), 1454 bytes captured (11632 bits) on interface 0
Ethernet II, Src: 68:07:15:c4:cc:a5 (68:07:15:c4:cc:a5), Dst: 94:65:2d:4e:c2:06 (94:65:2d:4e:c2:06)
Internet Protocol Version 4, Src: 192.168.43.208 (192.168.43.208), Dst: 62.234.120.220 (62.234.120.220)
Transmission Control Protocol, Src Port: 52472 (52472), Dst Port: http (80), Seq: 872, Ack: 1, Len: 1400

No.     Time           Source                Destination           Protocol Length Info
     28 9.777500000    192.168.43.208        62.234.120.220        TCP      1454   [TCP segment of a reassembled PDU]

Frame 28: 1454 bytes on wire (11632 bits), 1454 bytes captured (11632 bits) on interface 0
Ethernet II, Src: 68:07:15:c4:cc:a5 (68:07:15:c4:cc:a5), Dst: 94:65:2d:4e:c2:06 (94:65:2d:4e:c2:06)
Internet Protocol Version 4, Src: 192.168.43.208 (192.168.43.208), Dst: 62.234.120.220 (62.234.120.220)
Transmission Control Protocol, Src Port: 52472 (52472), Dst Port: http (80), Seq: 2272, Ack: 1, Len: 1400

No.     Time           Source                Destination           Protocol Length Info
     29 9.777515000    192.168.43.208        62.234.120.220        TCP      1454   [TCP segment of a reassembled PDU]

Frame 29: 1454 bytes on wire (11632 bits), 1454 bytes captured (11632 bits) on interface 0
Ethernet II, Src: 68:07:15:c4:cc:a5 (68:07:15:c4:cc:a5), Dst: 94:65:2d:4e:c2:06 (94:65:2d:4e:c2:06)
Internet Protocol Version 4, Src: 192.168.43.208 (192.168.43.208), Dst: 62.234.120.220 (62.234.120.220)
Transmission Control Protocol, Src Port: 52472 (52472), Dst Port: http (80), Seq: 3672, Ack: 1, Len: 1400

No.     Time           Source                Destination           Protocol Length Info
     30 9.777529000    192.168.43.208        62.234.120.220        TCP      1454   [TCP segment of a reassembled PDU]

Frame 30: 1454 bytes on wire (11632 bits), 1454 bytes captured (11632 bits) on interface 0
Ethernet II, Src: 68:07:15:c4:cc:a5 (68:07:15:c4:cc:a5), Dst: 94:65:2d:4e:c2:06 (94:65:2d:4e:c2:06)
Internet Protocol Version 4, Src: 192.168.43.208 (192.168.43.208), Dst: 62.234.120.220 (62.234.120.220)
Transmission Control Protocol, Src Port: 52472 (52472), Dst Port: http (80), Seq: 5072, Ack: 1, Len: 1400

No.     Time           Source                Destination           Protocol Length Info
     31 9.777543000    192.168.43.208        62.234.120.220        TCP      1454   [TCP segment of a reassembled PDU]

Frame 31: 1454 bytes on wire (11632 bits), 1454 bytes captured (11632 bits) on interface 0
Ethernet II, Src: 68:07:15:c4:cc:a5 (68:07:15:c4:cc:a5), Dst: 94:65:2d:4e:c2:06 (94:65:2d:4e:c2:06)
Internet Protocol Version 4, Src: 192.168.43.208 (192.168.43.208), Dst: 62.234.120.220 (62.234.120.220)
Transmission Control Protocol, Src Port: 52472 (52472), Dst Port: http (80), Seq: 6472, Ack: 1, Len: 1400

No.     Time           Source                Destination           Protocol Length Info
     32 9.820878000    62.234.120.220        192.168.43.208        TCP      54     http > 52472 [ACK] Seq=1 Ack=2272 Win=131584 Len=0

Frame 32: 54 bytes on wire (432 bits), 54 bytes captured (432 bits) on interface 0
Ethernet II, Src: 94:65:2d:4e:c2:06 (94:65:2d:4e:c2:06), Dst: 68:07:15:c4:cc:a5 (68:07:15:c4:cc:a5)
Internet Protocol Version 4, Src: 62.234.120.220 (62.234.120.220), Dst: 192.168.43.208 (192.168.43.208)
Transmission Control Protocol, Src Port: http (80), Dst Port: 52472 (52472), Seq: 1, Ack: 2272, Len: 0

No.     Time           Source                Destination           Protocol Length Info
     33 9.821034000    192.168.43.208        62.234.120.220        TCP      1454   [TCP segment of a reassembled PDU]

Frame 33: 1454 bytes on wire (11632 bits), 1454 bytes captured (11632 bits) on interface 0
Ethernet II, Src: 68:07:15:c4:cc:a5 (68:07:15:c4:cc:a5), Dst: 94:65:2d:4e:c2:06 (94:65:2d:4e:c2:06)
Internet Protocol Version 4, Src: 192.168.43.208 (192.168.43.208), Dst: 62.234.120.220 (62.234.120.220)
Transmission Control Protocol, Src Port: 52472 (52472), Dst Port: http (80), Seq: 7872, Ack: 1, Len: 1400

No.     Time           Source                Destination           Protocol Length Info
     34 9.821062000    192.168.43.208        62.234.120.220        TCP      1454   [TCP segment of a reassembled PDU]

Frame 34: 1454 bytes on wire (11632 bits), 1454 bytes captured (11632 bits) on interface 0
Ethernet II, Src: 68:07:15:c4:cc:a5 (68:07:15:c4:cc:a5), Dst: 94:65:2d:4e:c2:06 (94:65:2d:4e:c2:06)
Internet Protocol Version 4, Src: 192.168.43.208 (192.168.43.208), Dst: 62.234.120.220 (62.234.120.220)
Transmission Control Protocol, Src Port: 52472 (52472), Dst Port: http (80), Seq: 9272, Ack: 1, Len: 1400

No.     Time           Source                Destination           Protocol Length Info
     35 9.821083000    192.168.43.208        62.234.120.220        TCP      1454   [TCP segment of a reassembled PDU]

Frame 35: 1454 bytes on wire (11632 bits), 1454 bytes captured (11632 bits) on interface 0
Ethernet II, Src: 68:07:15:c4:cc:a5 (68:07:15:c4:cc:a5), Dst: 94:65:2d:4e:c2:06 (94:65:2d:4e:c2:06)
Internet Protocol Version 4, Src: 192.168.43.208 (192.168.43.208), Dst: 62.234.120.220 (62.234.120.220)
Transmission Control Protocol, Src Port: 52472 (52472), Dst Port: http (80), Seq: 10672, Ack: 1, Len: 1400

No.     Time           Source                Destination           Protocol Length Info
     36 9.821120000    192.168.43.208        62.234.120.220        TCP      1454   [TCP segment of a reassembled PDU]

Frame 36: 1454 bytes on wire (11632 bits), 1454 bytes captured (11632 bits) on interface 0
Ethernet II, Src: 68:07:15:c4:cc:a5 (68:07:15:c4:cc:a5), Dst: 94:65:2d:4e:c2:06 (94:65:2d:4e:c2:06)
Internet Protocol Version 4, Src: 192.168.43.208 (192.168.43.208), Dst: 62.234.120.220 (62.234.120.220)
Transmission Control Protocol, Src Port: 52472 (52472), Dst Port: http (80), Seq: 12072, Ack: 1, Len: 1400

No.     Time           Source                Destination           Protocol Length Info
     37 9.821151000    192.168.43.208        62.234.120.220        TCP      1454   [TCP segment of a reassembled PDU]

Frame 37: 1454 bytes on wire (11632 bits), 1454 bytes captured (11632 bits) on interface 0
Ethernet II, Src: 68:07:15:c4:cc:a5 (68:07:15:c4:cc:a5), Dst: 94:65:2d:4e:c2:06 (94:65:2d:4e:c2:06)
Internet Protocol Version 4, Src: 192.168.43.208 (192.168.43.208), Dst: 62.234.120.220 (62.234.120.220)
Transmission Control Protocol, Src Port: 52472 (52472), Dst Port: http (80), Seq: 13472, Ack: 1, Len: 1400

No.     Time           Source                Destination           Protocol Length Info
     38 9.821185000    192.168.43.208        62.234.120.220        TCP      1454   [TCP segment of a reassembled PDU]

Frame 38: 1454 bytes on wire (11632 bits), 1454 bytes captured (11632 bits) on interface 0
Ethernet II, Src: 68:07:15:c4:cc:a5 (68:07:15:c4:cc:a5), Dst: 94:65:2d:4e:c2:06 (94:65:2d:4e:c2:06)
Internet Protocol Version 4, Src: 192.168.43.208 (192.168.43.208), Dst: 62.234.120.220 (62.234.120.220)
Transmission Control Protocol, Src Port: 52472 (52472), Dst Port: http (80), Seq: 14872, Ack: 1, Len: 1400

No.     Time           Source                Destination           Protocol Length Info
     39 9.821219000    192.168.43.208        62.234.120.220        TCP      1454   [TCP segment of a reassembled PDU]

Frame 39: 1454 bytes on wire (11632 bits), 1454 bytes captured (11632 bits) on interface 0
Ethernet II, Src: 68:07:15:c4:cc:a5 (68:07:15:c4:cc:a5), Dst: 94:65:2d:4e:c2:06 (94:65:2d:4e:c2:06)
Internet Protocol Version 4, Src: 192.168.43.208 (192.168.43.208), Dst: 62.234.120.220 (62.234.120.220)
Transmission Control Protocol, Src Port: 52472 (52472), Dst Port: http (80), Seq: 16272, Ack: 1, Len: 1400

No.     Time           Source                Destination           Protocol Length Info
     40 9.825078000    62.234.120.220        192.168.43.208        TCP      54     http > 52472 [ACK] Seq=1 Ack=5072 Win=131584 Len=0

Frame 40: 54 bytes on wire (432 bits), 54 bytes captured (432 bits) on interface 0
Ethernet II, Src: 94:65:2d:4e:c2:06 (94:65:2d:4e:c2:06), Dst: 68:07:15:c4:cc:a5 (68:07:15:c4:cc:a5)
Internet Protocol Version 4, Src: 62.234.120.220 (62.234.120.220), Dst: 192.168.43.208 (192.168.43.208)
Transmission Control Protocol, Src Port: http (80), Dst Port: 52472 (52472), Seq: 1, Ack: 5072, Len: 0

No.     Time           Source                Destination           Protocol Length Info
     41 9.825227000    192.168.43.208        62.234.120.220        TCP      1454   [TCP segment of a reassembled PDU]

Frame 41: 1454 bytes on wire (11632 bits), 1454 bytes captured (11632 bits) on interface 0
Ethernet II, Src: 68:07:15:c4:cc:a5 (68:07:15:c4:cc:a5), Dst: 94:65:2d:4e:c2:06 (94:65:2d:4e:c2:06)
Internet Protocol Version 4, Src: 192.168.43.208 (192.168.43.208), Dst: 62.234.120.220 (62.234.120.220)
Transmission Control Protocol, Src Port: 52472 (52472), Dst Port: http (80), Seq: 17672, Ack: 1, Len: 1400

No.     Time           Source                Destination           Protocol Length Info
     42 9.825254000    192.168.43.208        62.234.120.220        TCP      1454   [TCP segment of a reassembled PDU]

Frame 42: 1454 bytes on wire (11632 bits), 1454 bytes captured (11632 bits) on interface 0
Ethernet II, Src: 68:07:15:c4:cc:a5 (68:07:15:c4:cc:a5), Dst: 94:65:2d:4e:c2:06 (94:65:2d:4e:c2:06)
Internet Protocol Version 4, Src: 192.168.43.208 (192.168.43.208), Dst: 62.234.120.220 (62.234.120.220)
Transmission Control Protocol, Src Port: 52472 (52472), Dst Port: http (80), Seq: 19072, Ack: 1, Len: 1400

No.     Time           Source                Destination           Protocol Length Info
     43 9.825273000    192.168.43.208        62.234.120.220        TCP      1454   [TCP segment of a reassembled PDU]

Frame 43: 1454 bytes on wire (11632 bits), 1454 bytes captured (11632 bits) on interface 0
Ethernet II, Src: 68:07:15:c4:cc:a5 (68:07:15:c4:cc:a5), Dst: 94:65:2d:4e:c2:06 (94:65:2d:4e:c2:06)
Internet Protocol Version 4, Src: 192.168.43.208 (192.168.43.208), Dst: 62.234.120.220 (62.234.120.220)
Transmission Control Protocol, Src Port: 52472 (52472), Dst Port: http (80), Seq: 20472, Ack: 1, Len: 1400

No.     Time           Source                Destination           Protocol Length Info
     44 9.825294000    192.168.43.208        62.234.120.220        TCP      1454   [TCP segment of a reassembled PDU]

Frame 44: 1454 bytes on wire (11632 bits), 1454 bytes captured (11632 bits) on interface 0
Ethernet II, Src: 68:07:15:c4:cc:a5 (68:07:15:c4:cc:a5), Dst: 94:65:2d:4e:c2:06 (94:65:2d:4e:c2:06)
Internet Protocol Version 4, Src: 192.168.43.208 (192.168.43.208), Dst: 62.234.120.220 (62.234.120.220)
Transmission Control Protocol, Src Port: 52472 (52472), Dst Port: http (80), Seq: 21872, Ack: 1, Len: 1400

No.     Time           Source                Destination           Protocol Length Info
     45 9.832258000    62.234.120.220        192.168.43.208        TCP      54     http > 52472 [ACK] Seq=1 Ack=7872 Win=131584 Len=0

Frame 45: 54 bytes on wire (432 bits), 54 bytes captured (432 bits) on interface 0
Ethernet II, Src: 94:65:2d:4e:c2:06 (94:65:2d:4e:c2:06), Dst: 68:07:15:c4:cc:a5 (68:07:15:c4:cc:a5)
Internet Protocol Version 4, Src: 62.234.120.220 (62.234.120.220), Dst: 192.168.43.208 (192.168.43.208)
Transmission Control Protocol, Src Port: http (80), Dst Port: 52472 (52472), Seq: 1, Ack: 7872, Len: 0

No.     Time           Source                Destination           Protocol Length Info
     46 9.832454000    192.168.43.208        62.234.120.220        TCP      1454   [TCP segment of a reassembled PDU]

Frame 46: 1454 bytes on wire (11632 bits), 1454 bytes captured (11632 bits) on interface 0
Ethernet II, Src: 68:07:15:c4:cc:a5 (68:07:15:c4:cc:a5), Dst: 94:65:2d:4e:c2:06 (94:65:2d:4e:c2:06)
Internet Protocol Version 4, Src: 192.168.43.208 (192.168.43.208), Dst: 62.234.120.220 (62.234.120.220)
Transmission Control Protocol, Src Port: 52472 (52472), Dst Port: http (80), Seq: 23272, Ack: 1, Len: 1400

No.     Time           Source                Destination           Protocol Length Info
     47 9.832492000    192.168.43.208        62.234.120.220        TCP      1454   [TCP segment of a reassembled PDU]

Frame 47: 1454 bytes on wire (11632 bits), 1454 bytes captured (11632 bits) on interface 0
Ethernet II, Src: 68:07:15:c4:cc:a5 (68:07:15:c4:cc:a5), Dst: 94:65:2d:4e:c2:06 (94:65:2d:4e:c2:06)
Internet Protocol Version 4, Src: 192.168.43.208 (192.168.43.208), Dst: 62.234.120.220 (62.234.120.220)
Transmission Control Protocol, Src Port: 52472 (52472), Dst Port: http (80), Seq: 24672, Ack: 1, Len: 1400

No.     Time           Source                Destination           Protocol Length Info
     48 9.832513000    192.168.43.208        62.234.120.220        TCP      1454   [TCP segment of a reassembled PDU]

Frame 48: 1454 bytes on wire (11632 bits), 1454 bytes captured (11632 bits) on interface 0
Ethernet II, Src: 68:07:15:c4:cc:a5 (68:07:15:c4:cc:a5), Dst: 94:65:2d:4e:c2:06 (94:65:2d:4e:c2:06)
Internet Protocol Version 4, Src: 192.168.43.208 (192.168.43.208), Dst: 62.234.120.220 (62.234.120.220)
Transmission Control Protocol, Src Port: 52472 (52472), Dst Port: http (80), Seq: 26072, Ack: 1, Len: 1400

No.     Time           Source                Destination           Protocol Length Info
     49 9.832547000    192.168.43.208        62.234.120.220        TCP      1454   [TCP segment of a reassembled PDU]

Frame 49: 1454 bytes on wire (11632 bits), 1454 bytes captured (11632 bits) on interface 0
Ethernet II, Src: 68:07:15:c4:cc:a5 (68:07:15:c4:cc:a5), Dst: 94:65:2d:4e:c2:06 (94:65:2d:4e:c2:06)
Internet Protocol Version 4, Src: 192.168.43.208 (192.168.43.208), Dst: 62.234.120.220 (62.234.120.220)
Transmission Control Protocol, Src Port: 52472 (52472), Dst Port: http (80), Seq: 27472, Ack: 1, Len: 1400

No.     Time           Source                Destination           Protocol Length Info
     50 9.885689000    62.234.120.220        192.168.43.208        TCP      54     http > 52472 [ACK] Seq=1 Ack=10672 Win=131584 Len=0

Frame 50: 54 bytes on wire (432 bits), 54 bytes captured (432 bits) on interface 0
Ethernet II, Src: 94:65:2d:4e:c2:06 (94:65:2d:4e:c2:06), Dst: 68:07:15:c4:cc:a5 (68:07:15:c4:cc:a5)
Internet Protocol Version 4, Src: 62.234.120.220 (62.234.120.220), Dst: 192.168.43.208 (192.168.43.208)
Transmission Control Protocol, Src Port: http (80), Dst Port: 52472 (52472), Seq: 1, Ack: 10672, Len: 0

No.     Time           Source                Destination           Protocol Length Info
     51 9.885835000    192.168.43.208        62.234.120.220        TCP      1454   [TCP segment of a reassembled PDU]

Frame 51: 1454 bytes on wire (11632 bits), 1454 bytes captured (11632 bits) on interface 0
Ethernet II, Src: 68:07:15:c4:cc:a5 (68:07:15:c4:cc:a5), Dst: 94:65:2d:4e:c2:06 (94:65:2d:4e:c2:06)
Internet Protocol Version 4, Src: 192.168.43.208 (192.168.43.208), Dst: 62.234.120.220 (62.234.120.220)
Transmission Control Protocol, Src Port: 52472 (52472), Dst Port: http (80), Seq: 28872, Ack: 1, Len: 1400

No.     Time           Source                Destination           Protocol Length Info
     52 9.885865000    192.168.43.208        62.234.120.220        TCP      1454   [TCP segment of a reassembled PDU]

Frame 52: 1454 bytes on wire (11632 bits), 1454 bytes captured (11632 bits) on interface 0
Ethernet II, Src: 68:07:15:c4:cc:a5 (68:07:15:c4:cc:a5), Dst: 94:65:2d:4e:c2:06 (94:65:2d:4e:c2:06)
Internet Protocol Version 4, Src: 192.168.43.208 (192.168.43.208), Dst: 62.234.120.220 (62.234.120.220)
Transmission Control Protocol, Src Port: 52472 (52472), Dst Port: http (80), Seq: 30272, Ack: 1, Len: 1400

No.     Time           Source                Destination           Protocol Length Info
     53 9.885885000    192.168.43.208        62.234.120.220        TCP      1454   [TCP segment of a reassembled PDU]

Frame 53: 1454 bytes on wire (11632 bits), 1454 bytes captured (11632 bits) on interface 0
Ethernet II, Src: 68:07:15:c4:cc:a5 (68:07:15:c4:cc:a5), Dst: 94:65:2d:4e:c2:06 (94:65:2d:4e:c2:06)
Internet Protocol Version 4, Src: 192.168.43.208 (192.168.43.208), Dst: 62.234.120.220 (62.234.120.220)
Transmission Control Protocol, Src Port: 52472 (52472), Dst Port: http (80), Seq: 31672, Ack: 1, Len: 1400

No.     Time           Source                Destination           Protocol Length Info
     54 9.885907000    192.168.43.208        62.234.120.220        TCP      1454   [TCP segment of a reassembled PDU]

Frame 54: 1454 bytes on wire (11632 bits), 1454 bytes captured (11632 bits) on interface 0
Ethernet II, Src: 68:07:15:c4:cc:a5 (68:07:15:c4:cc:a5), Dst: 94:65:2d:4e:c2:06 (94:65:2d:4e:c2:06)
Internet Protocol Version 4, Src: 192.168.43.208 (192.168.43.208), Dst: 62.234.120.220 (62.234.120.220)
Transmission Control Protocol, Src Port: 52472 (52472), Dst Port: http (80), Seq: 33072, Ack: 1, Len: 1400

No.     Time           Source                Destination           Protocol Length Info
     55 9.890604000    62.234.120.220        192.168.43.208        TCP      54     http > 52472 [ACK] Seq=1 Ack=13472 Win=131584 Len=0

Frame 55: 54 bytes on wire (432 bits), 54 bytes captured (432 bits) on interface 0
Ethernet II, Src: 94:65:2d:4e:c2:06 (94:65:2d:4e:c2:06), Dst: 68:07:15:c4:cc:a5 (68:07:15:c4:cc:a5)
Internet Protocol Version 4, Src: 62.234.120.220 (62.234.120.220), Dst: 192.168.43.208 (192.168.43.208)
Transmission Control Protocol, Src Port: http (80), Dst Port: 52472 (52472), Seq: 1, Ack: 13472, Len: 0

No.     Time           Source                Destination           Protocol Length Info
     56 9.890774000    192.168.43.208        62.234.120.220        TCP      1454   [TCP segment of a reassembled PDU]

Frame 56: 1454 bytes on wire (11632 bits), 1454 bytes captured (11632 bits) on interface 0
Ethernet II, Src: 68:07:15:c4:cc:a5 (68:07:15:c4:cc:a5), Dst: 94:65:2d:4e:c2:06 (94:65:2d:4e:c2:06)
Internet Protocol Version 4, Src: 192.168.43.208 (192.168.43.208), Dst: 62.234.120.220 (62.234.120.220)
Transmission Control Protocol, Src Port: 52472 (52472), Dst Port: http (80), Seq: 34472, Ack: 1, Len: 1400

No.     Time           Source                Destination           Protocol Length Info
     57 9.890801000    192.168.43.208        62.234.120.220        TCP      1454   [TCP segment of a reassembled PDU]

Frame 57: 1454 bytes on wire (11632 bits), 1454 bytes captured (11632 bits) on interface 0
Ethernet II, Src: 68:07:15:c4:cc:a5 (68:07:15:c4:cc:a5), Dst: 94:65:2d:4e:c2:06 (94:65:2d:4e:c2:06)
Internet Protocol Version 4, Src: 192.168.43.208 (192.168.43.208), Dst: 62.234.120.220 (62.234.120.220)
Transmission Control Protocol, Src Port: 52472 (52472), Dst Port: http (80), Seq: 35872, Ack: 1, Len: 1400

No.     Time           Source                Destination           Protocol Length Info
     58 9.890821000    192.168.43.208        62.234.120.220        TCP      1454   [TCP segment of a reassembled PDU]

Frame 58: 1454 bytes on wire (11632 bits), 1454 bytes captured (11632 bits) on interface 0
Ethernet II, Src: 68:07:15:c4:cc:a5 (68:07:15:c4:cc:a5), Dst: 94:65:2d:4e:c2:06 (94:65:2d:4e:c2:06)
Internet Protocol Version 4, Src: 192.168.43.208 (192.168.43.208), Dst: 62.234.120.220 (62.234.120.220)
Transmission Control Protocol, Src Port: 52472 (52472), Dst Port: http (80), Seq: 37272, Ack: 1, Len: 1400

No.     Time           Source                Destination           Protocol Length Info
     59 9.890847000    192.168.43.208        62.234.120.220        TCP      1454   [TCP segment of a reassembled PDU]

Frame 59: 1454 bytes on wire (11632 bits), 1454 bytes captured (11632 bits) on interface 0
Ethernet II, Src: 68:07:15:c4:cc:a5 (68:07:15:c4:cc:a5), Dst: 94:65:2d:4e:c2:06 (94:65:2d:4e:c2:06)
Internet Protocol Version 4, Src: 192.168.43.208 (192.168.43.208), Dst: 62.234.120.220 (62.234.120.220)
Transmission Control Protocol, Src Port: 52472 (52472), Dst Port: http (80), Seq: 38672, Ack: 1, Len: 1400

No.     Time           Source                Destination           Protocol Length Info
     60 9.895540000    62.234.120.220        192.168.43.208        TCP      54     http > 52472 [ACK] Seq=1 Ack=16272 Win=131584 Len=0

Frame 60: 54 bytes on wire (432 bits), 54 bytes captured (432 bits) on interface 0
Ethernet II, Src: 94:65:2d:4e:c2:06 (94:65:2d:4e:c2:06), Dst: 68:07:15:c4:cc:a5 (68:07:15:c4:cc:a5)
Internet Protocol Version 4, Src: 62.234.120.220 (62.234.120.220), Dst: 192.168.43.208 (192.168.43.208)
Transmission Control Protocol, Src Port: http (80), Dst Port: 52472 (52472), Seq: 1, Ack: 16272, Len: 0

No.     Time           Source                Destination           Protocol Length Info
     61 9.895678000    192.168.43.208        62.234.120.220        TCP      1454   [TCP segment of a reassembled PDU]

Frame 61: 1454 bytes on wire (11632 bits), 1454 bytes captured (11632 bits) on interface 0
Ethernet II, Src: 68:07:15:c4:cc:a5 (68:07:15:c4:cc:a5), Dst: 94:65:2d:4e:c2:06 (94:65:2d:4e:c2:06)
Internet Protocol Version 4, Src: 192.168.43.208 (192.168.43.208), Dst: 62.234.120.220 (62.234.120.220)
Transmission Control Protocol, Src Port: 52472 (52472), Dst Port: http (80), Seq: 40072, Ack: 1, Len: 1400

No.     Time           Source                Destination           Protocol Length Info
     62 9.895704000    192.168.43.208        62.234.120.220        TCP      1454   [TCP segment of a reassembled PDU]

Frame 62: 1454 bytes on wire (11632 bits), 1454 bytes captured (11632 bits) on interface 0
Ethernet II, Src: 68:07:15:c4:cc:a5 (68:07:15:c4:cc:a5), Dst: 94:65:2d:4e:c2:06 (94:65:2d:4e:c2:06)
Internet Protocol Version 4, Src: 192.168.43.208 (192.168.43.208), Dst: 62.234.120.220 (62.234.120.220)
Transmission Control Protocol, Src Port: 52472 (52472), Dst Port: http (80), Seq: 41472, Ack: 1, Len: 1400

No.     Time           Source                Destination           Protocol Length Info
     63 9.895724000    192.168.43.208        62.234.120.220        TCP      1454   [TCP segment of a reassembled PDU]

Frame 63: 1454 bytes on wire (11632 bits), 1454 bytes captured (11632 bits) on interface 0
Ethernet II, Src: 68:07:15:c4:cc:a5 (68:07:15:c4:cc:a5), Dst: 94:65:2d:4e:c2:06 (94:65:2d:4e:c2:06)
Internet Protocol Version 4, Src: 192.168.43.208 (192.168.43.208), Dst: 62.234.120.220 (62.234.120.220)
Transmission Control Protocol, Src Port: 52472 (52472), Dst Port: http (80), Seq: 42872, Ack: 1, Len: 1400

No.     Time           Source                Destination           Protocol Length Info
     64 9.895745000    192.168.43.208        62.234.120.220        TCP      1454   [TCP segment of a reassembled PDU]

Frame 64: 1454 bytes on wire (11632 bits), 1454 bytes captured (11632 bits) on interface 0
Ethernet II, Src: 68:07:15:c4:cc:a5 (68:07:15:c4:cc:a5), Dst: 94:65:2d:4e:c2:06 (94:65:2d:4e:c2:06)
Internet Protocol Version 4, Src: 192.168.43.208 (192.168.43.208), Dst: 62.234.120.220 (62.234.120.220)
Transmission Control Protocol, Src Port: 52472 (52472), Dst Port: http (80), Seq: 44272, Ack: 1, Len: 1400

No.     Time           Source                Destination           Protocol Length Info
     65 9.905874000    62.234.120.220        192.168.43.208        TCP      54     http > 52472 [ACK] Seq=1 Ack=20472 Win=131584 Len=0

Frame 65: 54 bytes on wire (432 bits), 54 bytes captured (432 bits) on interface 0
Ethernet II, Src: 94:65:2d:4e:c2:06 (94:65:2d:4e:c2:06), Dst: 68:07:15:c4:cc:a5 (68:07:15:c4:cc:a5)
Internet Protocol Version 4, Src: 62.234.120.220 (62.234.120.220), Dst: 192.168.43.208 (192.168.43.208)
Transmission Control Protocol, Src Port: http (80), Dst Port: 52472 (52472), Seq: 1, Ack: 20472, Len: 0

No.     Time           Source                Destination           Protocol Length Info
     66 9.906072000    192.168.43.208        62.234.120.220        TCP      1454   [TCP segment of a reassembled PDU]

Frame 66: 1454 bytes on wire (11632 bits), 1454 bytes captured (11632 bits) on interface 0
Ethernet II, Src: 68:07:15:c4:cc:a5 (68:07:15:c4:cc:a5), Dst: 94:65:2d:4e:c2:06 (94:65:2d:4e:c2:06)
Internet Protocol Version 4, Src: 192.168.43.208 (192.168.43.208), Dst: 62.234.120.220 (62.234.120.220)
Transmission Control Protocol, Src Port: 52472 (52472), Dst Port: http (80), Seq: 45672, Ack: 1, Len: 1400

No.     Time           Source                Destination           Protocol Length Info
     67 9.906113000    192.168.43.208        62.234.120.220        TCP      1454   [TCP segment of a reassembled PDU]

Frame 67: 1454 bytes on wire (11632 bits), 1454 bytes captured (11632 bits) on interface 0
Ethernet II, Src: 68:07:15:c4:cc:a5 (68:07:15:c4:cc:a5), Dst: 94:65:2d:4e:c2:06 (94:65:2d:4e:c2:06)
Internet Protocol Version 4, Src: 192.168.43.208 (192.168.43.208), Dst: 62.234.120.220 (62.234.120.220)
Transmission Control Protocol, Src Port: 52472 (52472), Dst Port: http (80), Seq: 47072, Ack: 1, Len: 1400

No.     Time           Source                Destination           Protocol Length Info
     68 9.906146000    192.168.43.208        62.234.120.220        TCP      1454   [TCP segment of a reassembled PDU]

Frame 68: 1454 bytes on wire (11632 bits), 1454 bytes captured (11632 bits) on interface 0
Ethernet II, Src: 68:07:15:c4:cc:a5 (68:07:15:c4:cc:a5), Dst: 94:65:2d:4e:c2:06 (94:65:2d:4e:c2:06)
Internet Protocol Version 4, Src: 192.168.43.208 (192.168.43.208), Dst: 62.234.120.220 (62.234.120.220)
Transmission Control Protocol, Src Port: 52472 (52472), Dst Port: http (80), Seq: 48472, Ack: 1, Len: 1400

No.     Time           Source                Destination           Protocol Length Info
     69 9.906182000    192.168.43.208        62.234.120.220        TCP      1454   [TCP segment of a reassembled PDU]

Frame 69: 1454 bytes on wire (11632 bits), 1454 bytes captured (11632 bits) on interface 0
Ethernet II, Src: 68:07:15:c4:cc:a5 (68:07:15:c4:cc:a5), Dst: 94:65:2d:4e:c2:06 (94:65:2d:4e:c2:06)
Internet Protocol Version 4, Src: 192.168.43.208 (192.168.43.208), Dst: 62.234.120.220 (62.234.120.220)
Transmission Control Protocol, Src Port: 52472 (52472), Dst Port: http (80), Seq: 49872, Ack: 1, Len: 1400

No.     Time           Source                Destination           Protocol Length Info
     70 9.906214000    192.168.43.208        62.234.120.220        TCP      1454   [TCP segment of a reassembled PDU]

Frame 70: 1454 bytes on wire (11632 bits), 1454 bytes captured (11632 bits) on interface 0
Ethernet II, Src: 68:07:15:c4:cc:a5 (68:07:15:c4:cc:a5), Dst: 94:65:2d:4e:c2:06 (94:65:2d:4e:c2:06)
Internet Protocol Version 4, Src: 192.168.43.208 (192.168.43.208), Dst: 62.234.120.220 (62.234.120.220)
Transmission Control Protocol, Src Port: 52472 (52472), Dst Port: http (80), Seq: 51272, Ack: 1, Len: 1400

No.     Time           Source                Destination           Protocol Length Info
     71 9.906246000    192.168.43.208        62.234.120.220        TCP      1454   [TCP segment of a reassembled PDU]

Frame 71: 1454 bytes on wire (11632 bits), 1454 bytes captured (11632 bits) on interface 0
Ethernet II, Src: 68:07:15:c4:cc:a5 (68:07:15:c4:cc:a5), Dst: 94:65:2d:4e:c2:06 (94:65:2d:4e:c2:06)
Internet Protocol Version 4, Src: 192.168.43.208 (192.168.43.208), Dst: 62.234.120.220 (62.234.120.220)
Transmission Control Protocol, Src Port: 52472 (52472), Dst Port: http (80), Seq: 52672, Ack: 1, Len: 1400

No.     Time           Source                Destination           Protocol Length Info
     72 9.911923000    62.234.120.220        192.168.43.208        TCP      54     http > 52472 [ACK] Seq=1 Ack=23272 Win=131584 Len=0

Frame 72: 54 bytes on wire (432 bits), 54 bytes captured (432 bits) on interface 0
Ethernet II, Src: 94:65:2d:4e:c2:06 (94:65:2d:4e:c2:06), Dst: 68:07:15:c4:cc:a5 (68:07:15:c4:cc:a5)
Internet Protocol Version 4, Src: 62.234.120.220 (62.234.120.220), Dst: 192.168.43.208 (192.168.43.208)
Transmission Control Protocol, Src Port: http (80), Dst Port: 52472 (52472), Seq: 1, Ack: 23272, Len: 0

No.     Time           Source                Destination           Protocol Length Info
     73 9.912065000    192.168.43.208        62.234.120.220        TCP      1454   [TCP segment of a reassembled PDU]

Frame 73: 1454 bytes on wire (11632 bits), 1454 bytes captured (11632 bits) on interface 0
Ethernet II, Src: 68:07:15:c4:cc:a5 (68:07:15:c4:cc:a5), Dst: 94:65:2d:4e:c2:06 (94:65:2d:4e:c2:06)
Internet Protocol Version 4, Src: 192.168.43.208 (192.168.43.208), Dst: 62.234.120.220 (62.234.120.220)
Transmission Control Protocol, Src Port: 52472 (52472), Dst Port: http (80), Seq: 54072, Ack: 1, Len: 1400

No.     Time           Source                Destination           Protocol Length Info
     74 9.912107000    192.168.43.208        62.234.120.220        TCP      1454   [TCP segment of a reassembled PDU]

Frame 74: 1454 bytes on wire (11632 bits), 1454 bytes captured (11632 bits) on interface 0
Ethernet II, Src: 68:07:15:c4:cc:a5 (68:07:15:c4:cc:a5), Dst: 94:65:2d:4e:c2:06 (94:65:2d:4e:c2:06)
Internet Protocol Version 4, Src: 192.168.43.208 (192.168.43.208), Dst: 62.234.120.220 (62.234.120.220)
Transmission Control Protocol, Src Port: 52472 (52472), Dst Port: http (80), Seq: 55472, Ack: 1, Len: 1400

No.     Time           Source                Destination           Protocol Length Info
     75 9.912127000    192.168.43.208        62.234.120.220        TCP      1454   [TCP segment of a reassembled PDU]

Frame 75: 1454 bytes on wire (11632 bits), 1454 bytes captured (11632 bits) on interface 0
Ethernet II, Src: 68:07:15:c4:cc:a5 (68:07:15:c4:cc:a5), Dst: 94:65:2d:4e:c2:06 (94:65:2d:4e:c2:06)
Internet Protocol Version 4, Src: 192.168.43.208 (192.168.43.208), Dst: 62.234.120.220 (62.234.120.220)
Transmission Control Protocol, Src Port: 52472 (52472), Dst Port: http (80), Seq: 56872, Ack: 1, Len: 1400

No.     Time           Source                Destination           Protocol Length Info
     76 9.912148000    192.168.43.208        62.234.120.220        TCP      1454   [TCP segment of a reassembled PDU]

Frame 76: 1454 bytes on wire (11632 bits), 1454 bytes captured (11632 bits) on interface 0
Ethernet II, Src: 68:07:15:c4:cc:a5 (68:07:15:c4:cc:a5), Dst: 94:65:2d:4e:c2:06 (94:65:2d:4e:c2:06)
Internet Protocol Version 4, Src: 192.168.43.208 (192.168.43.208), Dst: 62.234.120.220 (62.234.120.220)
Transmission Control Protocol, Src Port: 52472 (52472), Dst Port: http (80), Seq: 58272, Ack: 1, Len: 1400

No.     Time           Source                Destination           Protocol Length Info
     77 9.918269000    62.234.120.220        192.168.43.208        TCP      54     http > 52472 [ACK] Seq=1 Ack=26072 Win=131584 Len=0

Frame 77: 54 bytes on wire (432 bits), 54 bytes captured (432 bits) on interface 0
Ethernet II, Src: 94:65:2d:4e:c2:06 (94:65:2d:4e:c2:06), Dst: 68:07:15:c4:cc:a5 (68:07:15:c4:cc:a5)
Internet Protocol Version 4, Src: 62.234.120.220 (62.234.120.220), Dst: 192.168.43.208 (192.168.43.208)
Transmission Control Protocol, Src Port: http (80), Dst Port: 52472 (52472), Seq: 1, Ack: 26072, Len: 0

No.     Time           Source                Destination           Protocol Length Info
     78 9.918413000    192.168.43.208        62.234.120.220        TCP      1454   [TCP segment of a reassembled PDU]

Frame 78: 1454 bytes on wire (11632 bits), 1454 bytes captured (11632 bits) on interface 0
Ethernet II, Src: 68:07:15:c4:cc:a5 (68:07:15:c4:cc:a5), Dst: 94:65:2d:4e:c2:06 (94:65:2d:4e:c2:06)
Internet Protocol Version 4, Src: 192.168.43.208 (192.168.43.208), Dst: 62.234.120.220 (62.234.120.220)
Transmission Control Protocol, Src Port: 52472 (52472), Dst Port: http (80), Seq: 59672, Ack: 1, Len: 1400

No.     Time           Source                Destination           Protocol Length Info
     79 9.918439000    192.168.43.208        62.234.120.220        TCP      1454   [TCP segment of a reassembled PDU]

Frame 79: 1454 bytes on wire (11632 bits), 1454 bytes captured (11632 bits) on interface 0
Ethernet II, Src: 68:07:15:c4:cc:a5 (68:07:15:c4:cc:a5), Dst: 94:65:2d:4e:c2:06 (94:65:2d:4e:c2:06)
Internet Protocol Version 4, Src: 192.168.43.208 (192.168.43.208), Dst: 62.234.120.220 (62.234.120.220)
Transmission Control Protocol, Src Port: 52472 (52472), Dst Port: http (80), Seq: 61072, Ack: 1, Len: 1400

No.     Time           Source                Destination           Protocol Length Info
     80 9.918459000    192.168.43.208        62.234.120.220        TCP      1454   [TCP segment of a reassembled PDU]

Frame 80: 1454 bytes on wire (11632 bits), 1454 bytes captured (11632 bits) on interface 0
Ethernet II, Src: 68:07:15:c4:cc:a5 (68:07:15:c4:cc:a5), Dst: 94:65:2d:4e:c2:06 (94:65:2d:4e:c2:06)
Internet Protocol Version 4, Src: 192.168.43.208 (192.168.43.208), Dst: 62.234.120.220 (62.234.120.220)
Transmission Control Protocol, Src Port: 52472 (52472), Dst Port: http (80), Seq: 62472, Ack: 1, Len: 1400

No.     Time           Source                Destination           Protocol Length Info
     81 9.918481000    192.168.43.208        62.234.120.220        TCP      1454   [TCP segment of a reassembled PDU]

Frame 81: 1454 bytes on wire (11632 bits), 1454 bytes captured (11632 bits) on interface 0
Ethernet II, Src: 68:07:15:c4:cc:a5 (68:07:15:c4:cc:a5), Dst: 94:65:2d:4e:c2:06 (94:65:2d:4e:c2:06)
Internet Protocol Version 4, Src: 192.168.43.208 (192.168.43.208), Dst: 62.234.120.220 (62.234.120.220)
Transmission Control Protocol, Src Port: 52472 (52472), Dst Port: http (80), Seq: 63872, Ack: 1, Len: 1400

No.     Time           Source                Destination           Protocol Length Info
     82 9.925212000    62.234.120.220        192.168.43.208        TCP      54     http > 52472 [ACK] Seq=1 Ack=28872 Win=131584 Len=0

Frame 82: 54 bytes on wire (432 bits), 54 bytes captured (432 bits) on interface 0
Ethernet II, Src: 94:65:2d:4e:c2:06 (94:65:2d:4e:c2:06), Dst: 68:07:15:c4:cc:a5 (68:07:15:c4:cc:a5)
Internet Protocol Version 4, Src: 62.234.120.220 (62.234.120.220), Dst: 192.168.43.208 (192.168.43.208)
Transmission Control Protocol, Src Port: http (80), Dst Port: 52472 (52472), Seq: 1, Ack: 28872, Len: 0

No.     Time           Source                Destination           Protocol Length Info
     83 9.925213000    62.234.120.220        192.168.43.208        TCP      54     http > 52472 [ACK] Seq=1 Ack=31672 Win=131584 Len=0

Frame 83: 54 bytes on wire (432 bits), 54 bytes captured (432 bits) on interface 0
Ethernet II, Src: 94:65:2d:4e:c2:06 (94:65:2d:4e:c2:06), Dst: 68:07:15:c4:cc:a5 (68:07:15:c4:cc:a5)
Internet Protocol Version 4, Src: 62.234.120.220 (62.234.120.220), Dst: 192.168.43.208 (192.168.43.208)
Transmission Control Protocol, Src Port: http (80), Dst Port: 52472 (52472), Seq: 1, Ack: 31672, Len: 0

No.     Time           Source                Destination           Protocol Length Info
     84 9.925383000    192.168.43.208        62.234.120.220        TCP      1454   [TCP segment of a reassembled PDU]

Frame 84: 1454 bytes on wire (11632 bits), 1454 bytes captured (11632 bits) on interface 0
Ethernet II, Src: 68:07:15:c4:cc:a5 (68:07:15:c4:cc:a5), Dst: 94:65:2d:4e:c2:06 (94:65:2d:4e:c2:06)
Internet Protocol Version 4, Src: 192.168.43.208 (192.168.43.208), Dst: 62.234.120.220 (62.234.120.220)
Transmission Control Protocol, Src Port: 52472 (52472), Dst Port: http (80), Seq: 65272, Ack: 1, Len: 1400

No.     Time           Source                Destination           Protocol Length Info
     85 9.925410000    192.168.43.208        62.234.120.220        TCP      1454   [TCP segment of a reassembled PDU]

Frame 85: 1454 bytes on wire (11632 bits), 1454 bytes captured (11632 bits) on interface 0
Ethernet II, Src: 68:07:15:c4:cc:a5 (68:07:15:c4:cc:a5), Dst: 94:65:2d:4e:c2:06 (94:65:2d:4e:c2:06)
Internet Protocol Version 4, Src: 192.168.43.208 (192.168.43.208), Dst: 62.234.120.220 (62.234.120.220)
Transmission Control Protocol, Src Port: 52472 (52472), Dst Port: http (80), Seq: 66672, Ack: 1, Len: 1400

No.     Time           Source                Destination           Protocol Length Info
     86 9.925430000    192.168.43.208        62.234.120.220        TCP      1454   [TCP segment of a reassembled PDU]

Frame 86: 1454 bytes on wire (11632 bits), 1454 bytes captured (11632 bits) on interface 0
Ethernet II, Src: 68:07:15:c4:cc:a5 (68:07:15:c4:cc:a5), Dst: 94:65:2d:4e:c2:06 (94:65:2d:4e:c2:06)
Internet Protocol Version 4, Src: 192.168.43.208 (192.168.43.208), Dst: 62.234.120.220 (62.234.120.220)
Transmission Control Protocol, Src Port: 52472 (52472), Dst Port: http (80), Seq: 68072, Ack: 1, Len: 1400

No.     Time           Source                Destination           Protocol Length Info
     87 9.925452000    192.168.43.208        62.234.120.220        TCP      1454   [TCP segment of a reassembled PDU]

Frame 87: 1454 bytes on wire (11632 bits), 1454 bytes captured (11632 bits) on interface 0
Ethernet II, Src: 68:07:15:c4:cc:a5 (68:07:15:c4:cc:a5), Dst: 94:65:2d:4e:c2:06 (94:65:2d:4e:c2:06)
Internet Protocol Version 4, Src: 192.168.43.208 (192.168.43.208), Dst: 62.234.120.220 (62.234.120.220)
Transmission Control Protocol, Src Port: 52472 (52472), Dst Port: http (80), Seq: 69472, Ack: 1, Len: 1400

No.     Time           Source                Destination           Protocol Length Info
     88 9.925471000    192.168.43.208        62.234.120.220        TCP      1454   [TCP segment of a reassembled PDU]

